{
  "$schema": "https://json-schema.org/draft/2020-12/schema",
  "$id": "https://coldsofttech.github.io/vethuq-policy/schema/v1/catalog.schema.json",
  "title": "VethuQ add-on and bundle catalog payload (schema v1)",
  "description": "The payload carried inside the signed envelope of /v1/catalog.json: the add-ons and bundles that exist, with descriptions, so a person can see what is available and ask for it. Changes within schema major 1 are additive only; clients MUST ignore unknown fields, so additionalProperties is intentionally left open everywhere. All text is plain text, never HTML.",
  "type": "object",
  "required": ["schema_version", "sequence", "issued_at", "kid", "addons", "bundles"],
  "properties": {
    "schema_version": { "const": 1 },
    "sequence": {
      "description": "Monotonic sequence number of the catalog (its own counter, separate from the policy's). Clients reject a lower one than they accepted from the same key.",
      "type": "integer",
      "minimum": 1
    },
    "issued_at": { "type": "string", "format": "date-time" },
    "kid": { "description": "Id of the signing key. Must equal the kid in the envelope.", "$ref": "#/$defs/kid" },
    "request_url": {
      "description": "Where a person goes to ask for an add-on or bundle. Used when an entry has no request_url of its own.",
      "$ref": "#/$defs/url"
    },
    "addons": {
      "description": "Every add-on that exists, by its add-on id.",
      "type": "array",
      "maxItems": 500,
      "items": { "$ref": "#/$defs/addon" }
    },
    "bundles": {
      "description": "Every bundle: add-ons that are licensed together.",
      "type": "array",
      "maxItems": 100,
      "items": { "$ref": "#/$defs/bundle" }
    }
  },
  "$defs": {
    "kid": { "type": "string", "pattern": "^[A-Za-z0-9._-]{1,64}$" },
    "id": { "type": "string", "pattern": "^[a-z][a-z0-9-]{0,63}$" },
    "semver": {
      "type": "string",
      "pattern": "^(0|[1-9]\\d*)\\.(0|[1-9]\\d*)\\.(0|[1-9]\\d*)(-[0-9A-Za-z.-]+)?(\\+[0-9A-Za-z.-]+)?$"
    },
    "url": { "type": "string", "format": "uri", "pattern": "^https://", "maxLength": 500 },
    "status": {
      "description": "available, coming_soon (announced, not released) or deprecated (still works, no longer offered). Clients treat a status they do not know as available.",
      "type": "string",
      "minLength": 1,
      "maxLength": 32
    },
    "text": {
      "description": "Optional translations of the text fields, by language id (`es`, `te`). The entry's own fields are the fallback.",
      "type": "object",
      "propertyNames": { "pattern": "^[a-z]{2,3}(-[A-Za-z0-9]{2,8})?$" },
      "additionalProperties": {
        "type": "object",
        "properties": {
          "label": { "type": "string", "minLength": 1, "maxLength": 80 },
          "summary": { "type": "string", "minLength": 1, "maxLength": 160 },
          "description": { "type": "string", "maxLength": 2000 }
        }
      }
    },
    "addon": {
      "type": "object",
      "required": ["id", "label", "summary"],
      "properties": {
        "id": { "$ref": "#/$defs/id" },
        "label": { "type": "string", "minLength": 1, "maxLength": 80 },
        "summary": { "description": "One line.", "type": "string", "minLength": 1, "maxLength": 160 },
        "description": { "description": "Plain text, a few paragraphs at most.", "type": "string", "maxLength": 2000 },
        "kind": {
          "description": "What it adds: file-type, language, search-engine, ocr, tier, backup or another word. Clients show a kind they do not know as it is.",
          "type": "string",
          "minLength": 1,
          "maxLength": 32
        },
        "licence": {
          "description": "free or licensed.",
          "enum": ["free", "licensed"]
        },
        "bundles": {
          "description": "Ids of the bundles that include it.",
          "type": "array",
          "maxItems": 50,
          "uniqueItems": true,
          "items": { "$ref": "#/$defs/id" }
        },
        "status": { "$ref": "#/$defs/status" },
        "min_client": { "$ref": "#/$defs/semver" },
        "size_bytes": { "type": "integer", "minimum": 0 },
        "docs_url": { "$ref": "#/$defs/url" },
        "request_url": { "$ref": "#/$defs/url" },
        "translations": { "$ref": "#/$defs/text" }
      }
    },
    "bundle": {
      "type": "object",
      "required": ["id", "label", "summary", "addons"],
      "properties": {
        "id": { "$ref": "#/$defs/id" },
        "label": { "type": "string", "minLength": 1, "maxLength": 80 },
        "summary": { "type": "string", "minLength": 1, "maxLength": 160 },
        "description": { "type": "string", "maxLength": 2000 },
        "addons": {
          "description": "Ids of the add-ons it includes.",
          "type": "array",
          "minItems": 1,
          "maxItems": 200,
          "uniqueItems": true,
          "items": { "$ref": "#/$defs/id" }
        },
        "status": { "$ref": "#/$defs/status" },
        "docs_url": { "$ref": "#/$defs/url" },
        "request_url": { "$ref": "#/$defs/url" },
        "translations": { "$ref": "#/$defs/text" }
      }
    }
  }
}
